ConfigurationType	ConfigurationName	ItemType	TranslationKey	Expression	Translation_en-US	Translation_ru-RU
DocumentRelation	CreditLifeInsuranceQuoteCreatePolicyRelation	relations	relations@CreditLifeInsuranceQuoteCreatePolicyRelation@Title	CreditLifeInsuranceQuoteCreatePolicyRelation	CreatePolicy	Создать договор
DocumentRelation	CreditLifeInsuranceQuoteCreatePolicyRelation	rootConfiguration	CreditLifeInsuranceQuoteCreatePolicyRelation@Title	CreditLifeInsuranceQuoteCreatePolicyRelation	CreatePolicy	Создать договор
Rule	CreditLifeInsuranceQuoteCreatePolicyRelationFlowRule	rule	validation@CreatePolicyRestrictionByDate	flowRule	E: validation@CreatePolicyRestrictionByDate	E: Дата крайнего срока оплаты первого взноса уже прошла, создание договора запрещено. Скопируйте заявку, актуализируйте дату заключения и проведите повторное согласование.
Rule	CreditLifeInsuranceQuoteCreatePolicyRelationFlowRule	rule	validation@CreatePolicy_BlockTrigger	flowRule	E: validation@CreatePolicy_BlockTrigger	E: При заданных условиях заявка не может быть согласована
Rule	CreditLifeInsuranceQuoteCreatePolicyRelationFlowRule	rule	validation@CreatePolicy_NeedReview	flowRule	E: validation@CreatePolicy_NeedReview	E: Необходимо отправить заявку на рассмотрение СК